<?xml version="1.0" encoding="UTF-8"?>
<cancion duracion="4:47" anio="2008"  xmlns:xsi="http://www.w3.org/2001/XMLSchema-instance" xsi:noNamespaceSchemaLocation="Ejercicio3.xsd">
    <titulo>Give it 2 me</titulo>
    <compositores>
      <compositor>
        <nombres>Pharrell</nombres>
        <apellidos>Williams</apellidos>
      </compositor>
    </compositores>
    <productores>
      <productor>
        <nombres>Pharrell</nombres>
        <apellidos>Williams</apellidos>
      </productor>
    </productores>
    <sello>Warner Bros. Records</sello>
    <artista>Madonna</artista>
</cancion>